Competitor,Website,GBP Rating,GBP Reviews,Key Advantage,Vulnerability
Katy Pain Specialists (Villarreal),katypain.com,4.8,200+,"Established, long tenure in Katy","Basic website, no procedure pages, at capacity"
Katy Pain & Spine (Madan),doctormadan.com,4.5,150+,"Multiple doctors, CLS Health network","Bad office staff reviews, generic site"
Advanced Interventional Pain (Robledo),modulatepain.com,4.7,150+,Good procedure-specific pages,North Katy location only
The Spine and Sports Center (Benny),thespineandsportscenter.com,4.9,100+,"Sugar Land + Katy presence, strong brand","Higher-end positioning, may not take all insurance"
Dr. Imran Qureshi (YOU),drimranqureshi.com,5.0,42,"Availability, broad insurance, non-opioid focus","Site not indexed, no procedure pages, new to market"
